{
    "_id": {
        "$oid": "60dcc5861b8acb7f95d4cf97"
    },
    "description": "piso sevilla",
    "address": "avenida las ciencias",
    "rooms": [{
            "description": "salón",
            "floor": 1,
            "containers": []
        },
        {
            "description": "despacho",
            "floor": 1,
            "containers": [{
                    "description": "cajonera izquierda",
                    "compartments": [{
                            "description": "primer cajón",
                            "row": 1,
                            "column": "A",
                            "articles": [{
                                "_id": {
                                    "$oid": "60dccxx_ID_mando_xbox"
                                },
                                "description": "mando xbox",
                                "color": "negro",
                                "brand": "microsoft",
                                "model": "series x",
                                "group": "mando xbox",
                                "price": 45,
                                "store_link": "www...",
                                "serial_number": "abc123abc",
                                "purchase_date": "12/03/2021",
                                "warranty_years": 2,
                                "package": "60dccxx_ID_CAJA_mando_xbox"
                            }]
                        },
                        {
                            "description": "segundo cajón",
                            "row": 2,
                            "column": "A",
                            "articles": []
                        },
                        {
                            "description": "tercer y último cajón",
                            "row": 3,
                            "column": "A",
                            "articles": []
                        }
                    ]
                },
                {
                    "description": "armario izquierdo",
                    "compartments": [{
                        "description": "parte izquierda",
                        "row": 1,
                        "column": "A",
                        "articles": [{
                            "_id": {
                                "$oid": "60dccxx_ID_CAJA_mando_xbox"
                            },
                            "description": "caja mando xbox",
                            "color": "white",
                            "brand": "microsoft",
                            "model": "series x",
                            "group": "mando xbox",
                            "price": 0,
                            "store_link": "",
                            "serial_number": "",
                            "purchase_date": "",
                            "warranty_years": 0,
                            "package": ""
                        }]
                    }]
                },
                {
                    "description": "bedroom",
                    "floor": 1
                }
            ]
        }
    ]
}